TenDiaDanh,DiaChi,NoiDung,ImageURL,DichVu,ThongTinLienHe,DanhGia (Google Map),Lat,Lng
Suối Ba Hồ,"Thôn Vạn Thuận, Xã Ninh Ích, Thị xã Ninh Hòa, Khánh Hòa","Suối Ba Hồ cách Nha Trang 25km về phía Bắc, bắt nguồn từ đỉnh Hòn Son, cao trên 660m, chảy giữa hai triền núi đá xuống cánh đồng thôn Phú Hữu, xã Ninh Ích rồi đổ ra đầm Nha Phu.",https://statics.vinpearl.com/ba-ho-nha-trang--88_1628302881.jpg,07:30–16:30 phục vụ tham quan,Website: https://baho.vn,"4.5 sao( 228 đánh giá)
",12.3312716,109.0404291
Làng cổ Phú Vinh,"Thôn Phú Vinh, Xã Vĩnh Thạnh, Thành phố Nha Trang, Khánh Hòa","Vị trí: Làng cổ Phú Vinh thuộc xã Vĩnh Thạnh, thành phố Nha Trang, tỉnh Khánh Hòa.
	Ðặc điểm: Làng cổ Phú Vinh có lịch sử trên 200 năm và còn lưu lại trong lòng mình khá nhiều ngôi nhà cổ, mang đậm nét miền Trung.",https://vietnamtourism.vn/imguploads/tourist/2014/KhanhHoa/LangCoPhuVinh/33Langcophuvinh01.jpg,Tham quan và trải nghiệm trong khung thời gian sáng từ 8h00 - 11h00 và buổi chiều từ 13h00 - 16h30,N/A,4.4 sao (67 đánh giá),12.2677643,109.1533518
Khu di tích Trường Dục Thanh,"39 Trưng Nhị, Phường Đức Nghĩa, Thành phố Phan Thiết, Bình Thuận","Khu di tích trường Dục Thanh tọa lạc tại số 39 Trưng Nhị, phường Đức Nghĩa, Thành phố Phan Thiết. Trường được xây dựng năm 1907 ( xây dựng cùng năm với trường Đông Kinh Nghĩa Thục), ý nghĩa của tên trường Dục Thanh là ""Giáo dục thế hệ Thanh thiếu niên thức dậy ý thức dân tộc"", lúc bây giờ trường được xem là ngôi trường tiến bộ vang danh khắp nơi. Năm 1910, trên đường ra đi tìm đường cứu nước, người Thanh niên yêu nước Nguyễn Tất Thành đã dừng chân và dạy học tại ngôi trường này. Thầy Thành đã để lại tình cảm yêu thương, quyến luyến của các đồng nghiệp, học sinh và nhân dân Bình Thuận trong những ngày thầy giảng dạy tại nơi đây.",https://upload.wikimedia.org/wikipedia/commons/b/b8/Tr%C6%B0%E1%BB%9Dng_D%E1%BB%A5c_Thanh.jpg,"Tham quan di tích lịch sử, tìm hiểu về cuộc đời Chủ tịch Hồ Chí Minh, xem các hiện vật và tài liệu lịch sử, dịch vụ hướng dẫn viên (có thể liên hệ văn phòng Bảo tàng Hồ Chí Minh để thuê) trong 7:00 - 17:00 hàng ngày",N/A,4.6 sao (659 đánh giá),10.9285006,108.0958865
Tháp nước Phan Thiết,"Đường Bà Triệu, Phường Bình Hưng, Thành phố Phan Thiết, Bình Thuận",Tháp nước Phan Thiết do kiến trúc sư Hoàng thân Souphanuovong (sau này là Chủ tịch nước Cộng hòa Dân chủ Nhân dân Lào) thiết kế.,https://upload.wikimedia.org/wikipedia/commons/0/02/Phan_Thiet_river_by_night.jpg,"Giá vé
Miễn phí

Dịch vụ & Hoạt động
Tham quan, chụp ảnh check-in, dạo bộ trong công viên xanh mát xung quanh, ngắm cảnh sông Cà Ty, thưởng thức ẩm thực địa phương tại các quán ăn gần đó",N/A,4.5 sao (834 đánh giá),10.9288079,108.0999388
Gành Son,"Xã Chí Công, Xã Chí Công, Huyện Tuy Phong, Bình Thuận","Ngoài thành phố Phan Thiết xinh đẹp và quyến rũ, Bình Thuận còn nhiều điểm du lịch hấp dẫn khác níu chân du khách. Nếu một ngày bạn muốn lang thang, la cà khám phá vẻ đẹp của mảnh đất này, hãy đến thăm Gành Son - một điểm đến cách trung tâm thành phố Phan Thiết 80 km.",https://zoomtravel.vn/upload/images/ganh-son-phan-thiet-7.jpg,"Tham quan cảnh đẹp thiên nhiên, chụp ảnh, ngắm bình minh và hoàng hôn, tắm biển, trải nghiệm làng chài, cắm trại, thuê thuyền thúng hoặc kayak, thưởng thức hải sản tươi sống",N/A,4.2 sao (363 đánh giá),11.1831703,108.6215311
Đồi cát bay Mũi Né,"01 Hòn Rơm, ĐT716, Mũi Né, Thành phố Phan Thiết, Bình Thuận, Việt Nam","Đồi Cát Mũi Né còn được biết đến với nhiều tên gọi quen thuộc như Đồi Cát Bay, Đồi Cát Hồng, Đồi Cát Vàng,... Địa điểm du lịch Mũi Né hấp dẫn này nằm cách trung tâm thành phố Phan Thiết 25km, gần bãi biển Hòn Rơm. Nơi đây là địa điểm vui chơi và check-in nổi tiếng của “thiên đường miền nhiệt đới” Phan Thiết mà rất nhiều du khách yêu thích, thường xuyên lui tới.",https://bbt.1cdn.vn/2024/05/21/52hz-doi-cat-do(1).jpg,"Mở cửa miễn phí cả ngày - Khuyến nghị thời gian tham quan tốt nhất từ 5:00-8:00 sáng hoặc 16:00-18:00 chiều, Chi phí phát sinh theo dịch vụ sử dụng (Trượt cát (thuê ván trượt 10.000-20.000 VND/lượt), Thuê xe địa hình ATV (650.000 VND/20 phút/2 người), Tour xe Jeep khám phá đồi cát, Chụp ảnh check-in, Ngắm bình minh và hoàng hôn, Thưởng thức đặc sản địa phương (đậu hũ nóng, bánh quai vạc, bánh bột lọc))",N/A,4.1 sao (6083 đánh giá),10.9413448,108.286385
Dinh Thầy Thím,"Thôn Hiệp Tiến, Xã Tân Tiến, Thị xã La Gi, Bình Thuận","Dinh Thầy Thím đã tồn tại 138 năm qua, được xây dựng vào ngày 25/12 năm Tự Đức thứ 32 (1879 - 2017) tọa lạc giữa khu rừng dầu tĩnh mịch trên khu cát trắng nay thuộc thôn Tam Tân, xã Tân Tiến thị xã La Gi, cách trung tâm thị xã khoảng 12km về hướng tây bắc.",https://upload.wikimedia.org/wikipedia/commons/5/52/Dinh_th%E1%BA%A7y_th%C3%ADm.jpg,Miễn phí vào cổng,SĐT: 0326 205 529 https://dinhthaythim.vn/,4.5 sao (1717 đánh giá),10.7235005,107.8447271
Bàu Trắng,"thôn Hồng Lâm, Xã Hòa Thắng, Huyện Bắc Bình, Bình Thuận","Theo tiếng địa phương, bàu có nghĩa là “hồ”, xung quanh hồ lại có nhiều đồi cát trắng nên được gọi là Bàu Trắng.","https://ik.imagekit.io/tvlk/blog/2023/02/khu-du-lich-bao-trang-1.jpg?tr=q-70,c-at_max,w-1000,h-600"," Người lớn, 15.000 VNĐ / Vé ; Trẻ em trên 1m2, 15.000 VNĐ / Vé, đóng cửa 22h",Website: https://bautrangyoume.vn,4.5 sao (1611 đánh giá),11.0679311,108.4163598
Bãi biển Mỹ Khê,"Biển Mỹ Khê, Xã Tịnh Khê, Thành phố Quảng Ngãi, Quảng Ngãi","Bãi biển Mỹ Khê cách trung tâm tỉnh lỵ Quảng Ngãi 15km về hướng Đông Đông Bắc, nằm giữa dải ven biển đẹp từ nam cửa Đại với Cổ Lũy cô thôn đến Ba Làng An ở phía Bắc với các cảnh đẹp tự nhiên như An Hải sa bàn, thạch ky điếu tẩu, cửa biển Sa Kỳ.","https://ik.imagekit.io/tvlk/blog/2023/06/IvLBx31o-image.png?tr=q-70,c-at_max,w-1000,h-600",Mở bãi tắm giờ hành chính,N/A,4.7 sao (3666 đánh giá),15.1906337,108.8952905
Thạch Ky điếu tẩu,"thôn An Vĩnh, Xã Tịnh Kỳ, Thành phố Quảng Ngãi, Quảng Ngãi","Cách trung tâm thành phố Quảng Ngãi 16km về phía Đông Bắc, ghềnh đá Thạch Ky Điếu Tẩu (thôn An Vĩnh, xã Tịnh Kỳ) là một trong 12 danh thắng nổi tiếng của tỉnh Quảng Ngãi, mang vẻ đẹp độc đáo với nhiều điều kỳ thú. Nơi đây được ví như một tác phẩm sắp đặt nghệ thuật bằng đá, một tuyệt tác của thiên nhiên với những dấu tích về sự hoạt động của hệ thống núi lửa cùng quá trình biển tiến, biển thoái hàng triệu năm trước...",https://sakos.vn/wp-content/uploads/2024/02/thach_ky_dieu_tau_quang_ngai_2.jpg,Kỳ quan công cộng dành cho mọi nhà,N/A,4.4 sao (356 đánh giá),15.2044582,108.9224072
Hang Câu,"Dưới chân núi Thới Lới, xã An Hải, Huyện Lý Sơn, Quảng Ngãi","Hang Câu thuộc xã An Hải của huyện đảo Lý Sơn, dưới chân núi Thới Lới, tiếp liền với Chùa Hang, kéo dài về phía đông theo mé biển và hang được hình thành do nước biển ăn sâu vào chân núi Thới Lới tạo nên.",https://images.baoangiang.com.vn/image/fckeditor/upload/2022/20220802/images/8d76892fc22ddcb98ca82412720c80a1.jpg,"Thời gian di chuyển bằng tàu cao tốc là 30 – 35 phút, giá vé dao động từ 300.000 – 400.000 VND/ vé khứ hồi.",N/A,4.5 sao (327 đánh giá),20.4230691,106.1791643
Gành Yến,"Thôn Thanh Thủy, Xã Bình Hải, Huyện Bình Sơn, Quảng Ngãi","Cách trung tâm TP Quảng Ngãi về hướng bắc khoảng 35 km, thắng cảnh Gành Yến nằm bên làng chài thôn Thanh Thủy, xã Bình Hải, huyện Bình Sơn (Quảng Ngãi). Thắng cảnh này đến giờ vẫn giữ được nét hoang sơ, kỳ vĩ.",https://nld.mediacdn.vn/2020/6/11/10269510630892276911422824982511475673975744o-1591848920036414086040.jpg,Mở cửa cả ngày,N/A,4.2 sao (212 đánh giá),15.3232788,108.8804831
Di tích Chiến thắng Mỏ Cày,"thôn 1, Xã Đức Chánh, Huyện Mộ Đức, Quảng Ngãi","Di tích Địa điểm Chiến thắng Mỏ Cày thuộc thôn 1, xã Đức Chánh, huyện Mộ Đức, cách trung tâm tỉnh lỵ Quảng Ngãi khoảng 15 km về hướng Nam, cách huyện lỵ Mộ Đức 6km về hướng Bắc.",https://lh6.googleusercontent.com/proxy/4mw9ezBnApzaT9wTZdEIlZ3gj4zK9B5tI1KAd_JgLTLeXVHCrSiHTtaPh6Mf55OkTVyPJSM1Ihz1Xx8iC7QL4rol-KEHnqUc1wLEbAmRDmPPgCc,Mở cửa tham quan giờ hành chính,N/A,4.3 sao (71 đánh giá),14.999306,108.8742613
Bảo tàng Tổng hợp tỉnh Quảng Ngãi,"99 Lê Trung Đình, Phường Trần Hưng Đạo, Thành phố Quảng Ngãi, Quảng Ngãi","Bảo tàng Quảng Ngãi được thành lập vào năm 1989 trên cơ sở tách ra từ Bảo tàng Nghĩa Bình. Lúc bấy giờ, Kho Bảo tàng chỉ sở hữu hơn 200 hiện vật và Bảo tàng còn tiếp nhận thêm hiện vật của hai nhà trưng bày bổ sung đó là Khu chứng tích Sơn Mỹ và Bảo tàng Ba Tơ từ Bảo tàng Nghĩa Bình chuyển giao.",https://suntaxiquangngai.com/wp-content/uploads/2024/04/anh-chup-bao-tang-tong-hop-tinh-quang-ngai.webp,"Giờ mở cửa: sáng: 8h30 – 11h30, chiều: 13h30 – 16h30
Giá vé tham quan: 5.000đ/1 người",SĐT: 0256 3822 452,4.1 sao (290 đánh giá),15.1255756,108.8085692
Bãi biển Sa Huỳnh,"Biển Sa Huỳnh, Quốc lộ 1A, Phường Phổ Thạnh, Huyện Đức Phổ, Quảng Ngãi","Vị trí: Bãi biển nằm sát quốc lộ 1A, ở cây số 985, thuộc Phổ Thạnh, huyện Đức Phổ, tỉnh Quảng Ngãi.
	Đặc điểm: Bãi biển rất thuận tiện cho du khách đến nghỉ ngơi, tham quan, có motel để du khách dừng chân nghỉ rồi tiếp tục hành trình.",http://csdl.vietnamtourism.gov.vn/uploads/images/CSDLDLVN2019/QuangNgai/BienSaHuynh/SaHuynhBeach.jpg,Mở bãi tắm giờ hành chính,N/A,4.4 sao (134 đánh giá),14.766563,109.0369506
Di tích lịch sử Sơn Mỹ,"Thôn Tư Cung, Huyện Sơn Tịnh, Quảng Ngãi","Vị trí: Di tích lịch sử Sơn Mỹ nằm trên địa bàn xã Tịnh Khê, huyện Sơn Tịnh, tỉnh Quảng Ngãi.
	Đặc điểm: Sơn Mỹ là nơi đã ghi lại tội ác dã man của đế quốc Mỹ đối với nhân dân Việt Nam. Ngày 16/3/1968, lính Mỹ đã giết hại hàng trăm dân thường vô tội ở đây trong một cuộc hành quân huỷ diệt.",http://csdl.vietnamtourism.gov.vn/uploads/images/icon/SonMyVestigeSite4.jpg,"Giá vé tham quan Thánh địa Mỹ Sơn (Sơn Mỹ) năm 2025 như sau: người lớn Việt Nam là 100.000 VNĐ/người, trẻ em Việt Nam (5-15 tuổi) là 30.000 VNĐ/trẻ. Đối với khách quốc tế, giá vé là 150.000 VNĐ/người lớn và 50.000 VNĐ/trẻ em (5-15 tuổi). Trẻ em dưới 5 tuổi được miễn vé.",N/A,4.5 sao (598 đánh giá),15.1768507,108.8728156
Đảo Lý Sơn,"Nằm về phía Đông Bắc tỉnh Quảng Ngãi, Huyện Lý Sơn, Quảng Ngãi","Vị trí: nằm về phía Đông Bắc tỉnh Quảng Ngãi, cách đất liền 15 hải lý (khoảng 24km).

	Đặc điểm: giữ một vị trí chiến lược trên vùng biển Đông Việt Nam, chứa đựng tiềm năng du lịch và những tư liệu quý về Hoàng Sa.",http://csdl.vietnamtourism.gov.vn/uploads/images/icon/LySonIsland2.jpg,Tham quan giờ hành chính,N/A,N/A,15.3809098,109.1174595
Thắng cảnh Eo Gió,"thôn Lý Lương, Xã Nhơn Lý, Thành phố Qui Nhơn, Bình Định","Eo Gió thuộc khu vực 3, thôn Lý Lương, xã đảo Nhơn Lý, thành phố Quy Nhơn, tỉnh Bình Định. Là một eo biển xanh, đẹp hình vòng cung được những rặng núi đá cao uốn cong ôm trọn vào lòng. Không biết từ bao giờ hay xuất phát từ lòng mến mộ cảnh đẹp của các nhiếp ảnh gia và du khách khi đến tham quan tại đây, mà địa danh Eo Gió - đã được “phong tặng” là nơi có cảnh hoàng hôn đẹp nhất Việt Nam.",https://static.vinwonders.com/production/eo-gio-quy-nhon-4jpg.jpeg,Mở cửa cả ngày,N/A,4.3 sao (729 đánh giá),13.8343279,109.1673539
Đầm Thị Nại,"Nằm trên địa phận TP Quy Nhơn, huyện Tuy Phước, huyện Phù Cát, Phường Hải Cảng, Thành phố Qui Nhơn, Bình Định","Nằm cách thành phố Quy Nhơn 8km về phía đông bắc, đầm Thị Nại là đầm lớn nhất Bình Định có hệ sinh thái phong phú với nhiều loại động thực vật quý và nhiều thắng cảnh đẹp rất hấp dẫn du khách.",https://images2.thanhnien.vn/528068263637045248/2025/5/17/ct1-174748852317329085390.jpg,Mở cửa tham quan giờ hành chính,N/A,4.4 sao (67 đánh giá),13.8267506,109.2095666
Khu sinh thái Cồn Chim,"xã Phước Sơn, Phước Hòa, Phước Thuận, Huyện Tuy Phước, Bình Định","Nằm cách Tp. Quy Nhơn khoảng 15km, thuộc xã Phước Sơn, Phước Hòa, Phước Thuận - huyện Tuy Phước. Khu sinh thái Cồn Chim như một “ốc đảo” lọt thỏm giữa bốn bề xanh ngắt - xanh nước, xanh trời và xanh rừng ngập mặn. Những ngày gió lặng biển êm, có dịp xuôi thuyền trên đầm Thị Nại, du khách sẽ được hòa mình vào bầu không khí trong lành cùng với cảnh sắc thiên nhiên đẹp hữu tình và quyến rũ, “lá phổi xanh” của thành phố Quy Nhơn, cái tên khá quen thuộc và hấp dẫn du khách khi đến Bình Định.",https://quynhontourist.com/wp-content/uploads/2020/12/tour-con-chim-tieu-chung-vien-lang-song-vo-duong-chua-long-phuoc-1-ngay-quynhontourist.jpg,Mở cả ngày,SĐT: 0335 299 535,4.7 sao (183 đánh giá),13.867192,109.2279956
Bảo tàng Tổng hợp,"26 Nguyễn Huệ, Phường Lê Lợi, Thành phố Qui Nhơn, Bình Định","Bảo tàng Tổng hợp Bình Định tọa lạc trong Trung tâm thành phố Quy Nhơn, tại số 26 Nguyễn Huệ. Nơi đây trưng bày trên 1.000 tài liệu, hiện vật đem đến cho du khách cái nhìn vừa khái quát, vừa cụ thể về đất nước, con người Bình Định qua các thời kỳ lịch sử. Đặc biệt, với hàng trăm hiện vật về nền văn hóa Chămpa độc đáo đang được lưu giữ tại đây, Bảo tàng được cho là nơi trưng bày, lưu giữ nhiều hiện vật Chămpa nhất nhì nước ta, trong đó có tâm văn bua khác trên đá đầy bí ẩn mà nhiều nhà nghiên cứu vẫn chưa tìm ra lời giải đáp hoàn chỉnh.",https://quynhonhotel.com/wp-content/uploads/2023/08/review-bao-tang-tong-hop-binh-dinh-quynhonhotel-24.jpg,"Giờ mở cửa: sáng: 8h30 – 11h30, chiều: 13h30 – 16h30
Giá vé tham quan: 5.000đ/1 người",SĐT: 0256 3822 452,4.1 sao (292 đánh giá),13.7705756,109.2333789
Nhà thờ Mằng Lăng,"Thôn Mằng Lăng, Xã An Thạch, Huyện Tuy An, Phú Yên","Nhà thờ Mằng Lăng thuộc xã An Thạch, huyện Tuy An, cách trung tâm thành phố Tuy Hòa 35 km về phía Bắc.",https://zoomtravel.vn/upload/images/nha-tho-mang-lang-2.jpeg,Mở cửa tham quan giờ hành chính,N/A,4.6 sao (1355 đánh giá),13.3341817,109.2259528
Không gian trưng bày Quảng Đức Xưa,"Khu phố Ngân Sơn, Thị trấn Chí Thạnh, Huyện Tuy An, Phú Yên","Nằm ngay quốc lộ 1, đầu đường đi nhà thờ Mằng Lăng, gành Đá Đĩa, không gian văn hóa du lịch Quảng Đức Xưa gồm ba ngôi nhà cổ và vườn cây ăn trái thoáng đãng, trưng bày gần 100 cối đá xay bột, cối quết, hòn đá cà; các dụng cụ nông nghiệp xưa...",https://mia.vn/media/uploads/blog-du-lich/nha-co-quang-duc-xua-va-ve-dep-hoai-co-cua-lang-gom-co-quang-duc-vang-bong-mot-thoi-1637616806.jpg,Mở cả ngày,N/A,4.3 sao (685 đánh giá),13.322198,109.2135321
Hòn lao Mái Nhà,"Thôn Phước Đồng, Huyện Tuy An, Phú Yên","Hòn lao Mái Nhà tại thôn Phước Đồng, xã An Hải, huyện Tuy An, tỉnh Phú Yên, là đảo nhỏ nằm chơ vơ giữa biển khơi, cách Đầm Ô Loan hơn 4km, cách thành phố Tuy Hòa 27 km về hướng Bắc còn có tên gọi khác Cù lao Mái Nhà.",https://mia.vn/media/uploads/blog-du-lich/trai-nghiem-tai-hon-lao-mai-nha-cu-lao-mai-nha-hon-dao-robinson-cua-phu-yen-02-1637439187.jpg,Mở cửa tham quan giờ hành chính,N/A,4.5 sao (192 đánh giá),13.2810606,109.3350525
Hòn Chùa,"Vùng biển Long Thủy, Xã An Phú, Thành phố Tuy Hoà, Phú Yên","Hòn Chùa  thuộc  xã An Phú, TP. Tuy Hòa, cách trung tâm thành phố khoảng 8 km về phía Bắc theo tuyến đường ven biển. Du khách có thể xuất phát từ bãi biển Long Thủy, khoảng 10 phút đi thuyền để ra Hòn Chùa.",https://static.vinwonders.com/production/hon-chua-phu-yen-1.jpg,Mở cửa tham quan giờ hành chính,N/A,4.5 sao (25 đánh giá),13.1767896,109.3084718
Bảo tàng Phú Yên,"151 Trần Phú, Phường 5, Thành phố Tuy Hoà, Phú Yên","Bảo tàng Phú Yên tọa lạc tại 151 Trần Phú, Phường 5, TP. Tuy Hòa, là một trong những công trình văn hóa tiêu biểu của Phú Yên. Bảo tàng có tổng diện tích 3 ha, bên trong bảo tàng hiện đang trưng bày hàng chục ngàn cổ vật, hiện vật đạt chuẩn quốc gia. Với sức hấp dẫn đó, bảo tàng Phú Yên đang từng bước trở thành điểm du lịch đáng chú ý của đông đảo du khách.",https://mia.vn/media/uploads/blog-du-lich/bao-tang-phu-yen-noi-luu-giu-truyen-thong-van-hoa-lau-doi-01-1637677730.jpeg,"Vé cho khách tham quan chung: Khoảng 20.000 - 40.000 VNĐ/người.
Vé cho học sinh, sinh viên: Khoảng 10.000 - 20.000 VNĐ/người.
Miễn phí vé: Trẻ em dưới 6 tuổi hoặc các trường hợp đặc biệt khác. ",SĐT: 0257 6299 777,4.1 sao (418 đánh giá),13.0942967,109.302062
Núi Đá Bia,"Tọa lạc trên khối núi Đại Lãnh thuộc dãy núi Đèo Cả, Xã Hòa Xuân Nam, Huyện Đông Hòa, Phú Yên","Núi Đá Bia (còn gọi là Thạch Bi Sơn) cao 706m, sừng sững uy nghi ở phía Bắc dãy Đèo Cả. Trên đỉnh núi là một khối đá khổng lồ cao 76m, có hình thù kỳ lạ, sáng sớm hay về chiều thường có mây trắng bao phủ chung quanh, khi ẩn khi hiện.","https://ik.imagekit.io/tvlk/blog/2023/07/go-and-share-nui-da-bia-phu-yen-7.jpg?tr=q-70,c-at_max,w-500,h-250,dpr-2",Mở cả ngày,"Núi Đá Bia: ngọn núi hùng vĩ, linh thiêng của xứ Nẫu",4.6 sao (120 đánh giá),12.8988657,109.3994233
Đồng Cừu An Hòa,"Thôn An Hòa, Xã Xuân Hải, Huyện Ninh Hải, Ninh Thuận","Đồng cừu An Hòa thuộc địa phận thôn An Hòa, xã Xuân Hải, huyện Ninh Hải, tỉnh Ninh Thuận. Nằm cách trung tâm thành phố Phan Rang - Tháp Chàm khoảng 16km theo hướng Tây Bắc, hướng đi quốc lộ 1A ra Nha Trang. Đây là một trong những địa điểm chăn nuôi và thả cừu tự do lớn nhất tỉnh Ninh Thuận.",https://static.vinwonders.com/production/dong-cuu-An-Hoa-1.jpg,Giá vé tham quan đồng cừu An Hòa · Xe 4 – 7 chỗ: 100.000 – 150.000 VNĐ/xe · Xe 16 chỗ: 200.000 VNĐ/xe · Xe 29 chỗ: 300.000 VNĐ/xe · Xe 45 chỗ: 400.000 VNĐ/xe.,0908 181 014,4.2 sao (155 đánh giá),16.4579581,107.5953574
Hòn Đỏ,"Thôn Mỹ Hiệp, Xã Thanh Hải, Huyện Ninh Hải, Ninh Thuận","Hòn Đỏ là một quần thể san hô hóa thạch thuộc địa phận thôn Mỹ Hiệp, xã Thanh Hải, huyện Ninh Hải, tỉnh Ninh Thuận, cách trung tâm thành phố Phan Rang - Tháp Chàm khoảng 17 km, trên tuyến đường ven biển nổi tiếng Việt Nam, với các địa danh mà ắt hẳn, những người yêu thích du lịch bụi đều biết tới.",https://www.vietnambooking.com/wp-content/uploads/2023/10/hon-do-ninh-thuan-3.jpg,Mở cửa tham quan giờ hành chính,N/A,4.4 sao (116 đánh giá),12.2665765,109.2084537
Vườn nho Ba Mọi,"Thôn Hiệp Hòa, Xã Phước Thuận, Huyện Ninh Phước, Ninh Thuận","Nhắc đến Ninh Thuận chắc hẳn nhiều người sẽ nghĩ ngay đến những vườn nho chín mọng. Ở mảnh đất nhiều nắng nhiều gió này không quá khó khăn để bạn tìm được cho mình một vườn nho để đến tham quan. Tuy nhiên, nổi tiếng nhất có lẽ chính là vườn nho Ba Mọi.",https://static.vinwonders.com/production/vuon-nho-ba-moi-2.jpg,"Giờ mở cửa: Thứ 2 đến thứ 7 – 7:00 – 17:30
Giá vé tham quan vườn nho Ba Mọi: Miễn phí vào cửa",0918 143 555,4.4 sao (534 đánh giá),11.5863024,108.9567159
Cồn cát trắng Tuấn Tú,"Thôn Tuấn Tú, Xã An Hải, Huyện Ninh Phước, Ninh Thuận","Thuộc thôn Tuấn Tú, xã An Hải, huyện Ninh Phước nhưng mang vẻ đẹp khác biệt hoàn toàn với cồn cát đỏ Nam Cương là cồn cát trắng Tuấn Tú.",https://media.ninhthuantourism.vn/resources/portal/Images/NTN/dulichninhthuan/21_5/doi_cat_nam_cuong_719592852.jpg,Giá vé tham quan: miễn phí,N/A,4.3 sao (1093 đánh giá),11.5087904,108.9971041
Trùng Sơn Cổ Tự,"Núi Đá Chồng, Thị trấn Khánh Hải, Huyện Ninh Hải, Ninh Thuận","Là ngôi chùa đầu tiên tại Ninh Thuận được khách du lịch trong và ngoài tỉnh biết đến nhiều nhất, Trùng Sơn Cổ Tự đang dần trở thành một thành tố quan trọng không thể thiếu trong những hành trình thưởng ngoạn cảnh đẹp. Với vẻ đẹp và sự nguy nga của một công trình kiến trúc đặc sắc, Trùng Sơn Cổ Tự được ví như biểu tượng của tín ngưỡng tâm linh trong thời hiện đại.",https://static.vinwonders.com/production/optimize_trung-son-co-tu-1.jpg,Chùa mở cửa tham quan cả ngày,N/A,4.7 sao (448 đánh giá),11.5933579,109.0307957
Tháp Pô Klông Garai,"Khu phố 8, Phường Đô Vinh, Thành phố Phan Rang-Tháp Chàm, Ninh Thuận","Trên lộ trình đường sắt Bắc Nam, lại nằm sát quốc lộ 27A đi Đà Lạt, cách trung tâm Phan Rang - Tháp Chàm 07 km về phía Tây là quần thể tháp Chàm nằm trọn vẹn trên ngọn đồi có tên là Đồi Trầu, thuộc khu phố 8, phường Đô Vinh. Đây là cụm tháp được xây dựng từ thế kỷ XIII để thờ vị vua Chăm trị vì xứ Panduranga (Ninh Thuận ngày nay); ông có tên là Pô Klông Garai (1151 - 1205); hiện nay cụm tháp còn nguyên vẹn về cả công trình kiến trúc lẫn việc tổ chức thờ phượng, cúng kính của người Chăm.",https://upload.wikimedia.org/wikipedia/commons/thumb/4/4f/Po_Klong_Garai.jpg/1280px-Po_Klong_Garai.jpg,15000/người (chỉ bao gồm vé vào cổng),N/A,4.5 sao (641 đánh giá),11.6019055,108.946504
Sở chỉ huy chiến dịch Điện Biên Phủ,"F535+GX9 Di tích Lịch sử, Quốc lộ 279B, bản Phăng, h. Điện Biên, Điện Biên","Nơi đây là trung tâm chỉ huy của Đại tướng Võ Nguyên Giáp và là nơi làm việc của bộ tham mưu, bao gồm các vị trí quan trọng như Tham mưu trưởng Hoàng Văn Thái. Sở chỉ huy này bao gồm nhiều hạng mục được bố trí trong một hệ thống liên hoàn có hầm hào và lán trại, như đài quan sát, hầm thông tin, lán làm việc của các lãnh đạo, nhà hội trường và hầm ban chính tr",https://dienbientv.vn/dataimages/201505/original/images1064336_dien_bien_phu.1.2.3.jpg,Hiện tại mức giá vé tham quan Sở Chỉ Huy Chiến Dịch Điện Biên Phủ đang có giá là 20.000vnđ/ vé.,N/A,4.6 sao (304 đánh giá),21.4537778,103.1599981
