TenDiaDanh,DiaChi,NoiDung,ImageURL,DichVu,ThongTinLienHe,DanhGia (Google Map),Lat,Lng
Khu căn cứ Tỉnh ủy (căn cứ Bà Bái),"ấp Phương Quới, Xã Phương Bình, Huyện Phụng Hiệp, Hậu Giang","Trong chiến dịch tổng tiến công và nổi dậy mùa xuân năm 1975 của toàn miền Nam, các đồng chí trong Ban Chấp hành tỉnh Đảng bộ cũng từ đây đi theo các mũi tiến công về Cần Thơ, Vị Thanh và các trọng điểm khác của ""Vùng IV chiến thuật"", đánh chiếm sân bay Trà Nóc, dinh tỉnh trưởng Cần Thơ. Vào hồi 11h30 ngày 30/4/1975, tiếng nói đầu tiên của UBND cách mạng được phát lên sóng của đài phát thanh Cần Thơ.",https://dulichthuduc.com.vn/vnt_upload/news/MIEN-TAY/hau-giang/can_cu_tinh_uy_can_tho_du_lich_thu_duc_1.jpg,Không tham quan,N/A,4.6 sao (76 đánh giá),"97,355,375",105.6260469
Khu Bảo tồn Thiên nhiên Lung Ngọc Hoàng,"QFVH+CJQ, ĐT931B, Phường 5, Vị Thanh, Hậu Giang","Khu Bảo tồn Thiên nhiên Lung Ngọc Hoàng tọa lạc tại huyện Phụng Hiệp, tỉnh Hậu Giang cách thành phố Vị Thanh khoảng 40km. Với tổng diện tích trên 2.800ha trải dài từ phía Tây sông Hậu đến tận vùng U Minh, không chỉ được mệnh danh là “lá phổi xanh” của đồng bằng Sông Cửu Long, Lung Ngọc Hoàng còn là nơi bảo tồn đa dạng sinh học độc đáo nhất cả nước hiện nay.",https://mia.vn/media/uploads/blog-du-lich/khu-bao-ton-thien-nhien-lung-ngoc-hoang-3-1718620080.jpg,Không tham quan,N/A,N/A,9.7206578,105.6922479
Di tích lịch sử quốc gia đặc biệt Chiến thắng Chương Thiện,"Phường V, thành phố Vị Thanh và xã Vĩnh Viễn, huyện Long Mỹ , Phường IV, Thành phố Vị Thanh, Hậu Giang","Di tích lịch sử đặc biệt Chiến thắng Chương Thiện nơi ghi lại những bước thăng trầm của lịch sử tỉnh Hậu Giang trong cuộc chiến tranh với sự mất mát, hy sinh vì bình yên, ấm no, hạnh phúc của nhân dân. Di tích Chiến thắng Chương Thiện đã được xếp hạng là Di tích lịch sử Quốc gia đặc biệt và trở thành điểm đến không thể bỏ qua trong hành trình du lịch Hậu Giang.",https://tuoitrehaugiang.org.vn/images/post/images/1678971898783882481-1.png,Miễn phí,N/A,4.5 sao (38 đánh giá),"97,935,888",105.4791181
Đền thờ Bác Hồ,"ấp 3, Xã Lương Tâm, Huyện Long Mỹ, Hậu Giang","Đền thờ Bác Hồ được xây dựng vào năm 1990 trên vùng đất phía Bắc, nơi giao nhau của hai con kinh là Long Mỹ II và Năm Căn, thuộc ấp 3, xã Lương Tâm, huyện Long Mỹ, cách thị trấn Long Mỹ 21km và TP Cần Thơ 78km về phía Tây Nam. Đền thờ Bác Hồ nay thuộc địa phận xã Lương Tâm, huyện Long Mỹ, tỉnh Hậu Giang.",https://media.haugiang.gov.vn/resources/portal/Images/HGI/adminportal.hgi/img_0996_16188566.jpg,N/A,Đền thờ Bác Hồ trên đỉnh Ba Vì – VƯỜN QUỐC GIA BA VÌ,4.6 sao (284 đánh giá),9.6200397,105.4588879
Chùa Aranhứt,"ấp Long An A, Thị trấn Cái Tắc, Huyện Châu Thành A, Hậu Giang","Tọa lạc tại ấp Long An A, thị trấn Cái Tắc, huyện Châu Thành A, chùa Aranhứt được xác định là ngôi chùa Khmer cổ nhất tại Hậu Giang và là một trong những chùa Khmer cổ nhất ở ĐBSCL.",https://dulichhaugiang.com.vn/wp-content/uploads/2024/03/DLHG_ChuaKmerAranNhut3.png,Mở cửa tham quan giờ hành chính,N/A,4.8 sao (19 đánh giá),9.9303829,105.7425022
Hải đăng Kê Gà,"Cách Phan Thiết khoảng 30 km, Xã Tân Thành, Huyện Hàm Thuận Nam, Bình Thuận","Hải đăng Kê Gà ở mũi Kê Gà, thuộc xã Tân Thành, tỉnh Lâm Đồng. Đây là một ngọn hải đăng dùng cho tàu thuyền giao thông trong khu vực, và đã được trung tâm sách kỷ lục Việt Nam xác nhận là ngọn hải đăng cao nhất và cổ xưa nhất Việt Nam.",https://cdn.aarp.net/content/dam/aarpe/en/home/events-history/911-anniversary/_jcr_content/root/container_main/container_body_main/container_body1/container_body_cf/container_image/articlecontentfragment/cfimage.coreimg.50.688.jpeg/content/dam/aarp/politics/events-and-history/2021/08/1140-9-11-towers-attack-explosion.jpg,Tham quan chụp ảnh miễn phí,N/A,4.4 sao (2121 đánh giá),10.6952853,107.9915815
Núi lửa Chư Đăng Ya,"Cách trung tâm thành phố Pleiku khoảng 30km về hướng đông bắc, Xã Chư Đăng Ya, Huyện Chư Păh, Gia Lai","Chư Đăng Ya là một ngọn núi lửa đã ngưng hoạt động hàng triệu năm, miệng núi lửa có hình phễu, cao khoảng 500m so với mưc nước biển. Núi lửa Chư Đăng Ya nằm ẩn mình giữa rừng xanh đại ngàn hùng vĩ.

Đến với Chư Đăng Ya, du khách có thể chiêm ngưỡng sự thay đổi của những sắc màu rực rỡ theo từng mùa. Vào mùa khô, núi lửa Chư Đăng Ya được phủ kín màu vàng rực của hàng vạn bông dã quỳ đua nhau khoe sắc. Đặc biệt, vào tháng 11 là thời điểm hàng trăm ngàn bông hoa dã quỳ đua nhau khoe sắc, phủ vàng trên khắp các nẻo đường và đồi núi.

Vài năm trở lại đây, tỉnh Gia Lai đã tổ chức Lễ hội hoa dã quỳ để quảng bá hình ảnh du lịch địa phương đến với du khách gần xa. Lễ hội có nhiều hoạt động văn hóa và trải nghiệm hấp dẫn như: biểu diễn cồng chiêng, dệt thổ cẩm, đan lát, tạc tượng, leo núi trải nghiệm, bay dù lượn trên núi lửa Chư Đang Ya, hội chợ nông sản, ẩm thực, đặc sản địa phương…

Còn vào mùa mưa, Chư Đang Ya đắm trong sắc đỏ của những vạt hoa dong riềng, ngập tràn quanh núi lửa. Cây dong riềng còn có tên gọi khác là cây môn chuối hoặc cây khoai chuối, hoa thường nở rộ từ tháng 7 đến tháng 10 hàng năm.

Sắc vàng của hoa dã quỳ và sắc đỏ của hoa dong riềng là một trong những điều thu hút du khách, nhiếp ảnh gia từ khắp nơi đến đây để tìm cho mình không gian bình yên, thư thái cũng như có những bức hình để đời.

Đến Chư Đăng Ya bạn sẽ cảm nhận sự yên bình trong tâm hồn khác xa sự ồn ào phố thị. Bởi Chư Đăng Ya bao trùm cảnh thiên nhiên hoang sơ, cây cối xanh ngút ngàn đậm nét Tây Nguyên.",https://images.vietnamtourism.gov.vn/vn//images/2021/Thang_6/nui_lua_chu_dang_ya__gia_lai_1572025654_resize.jpeg,N/A,N/A,4.6 sao (649 đánh giá),14.1289426,108.0545491
Hồ T’Nưng,"Nằm ở phía bắc thành phố Pleiku, Xã Biển Hồ, Thành phố Pleiku, Gia Lai","Hồ T'Nưng hay Biển Hồ hoặc hồ Ea Nueng là một hồ nước ngọt nằm tại xã Biển Hồ ở phía bắc thành phố Pleiku, tỉnh Gia Lai. Biển Hồ vốn là 3 miệng núi lửa cổ thông với nhau, bờ hồ chính là miệng núi lửa nhô cao nên dù đứng từ xa vẫn nhìn thấy rõ.",https://images.vietnamtourism.gov.vn/vn//images/2021/Thang_6/ho_t%27nung__gia_lai_1572000946_resize.jpeg,"Mở cửa cả ngày, tổ chức nhiều hoạt động ngoài trời",N/A,4.4 sao (597 đánh giá),14.0670538,108.0198835
Biển Hồ chè,"Thuộc ấp Bình Định, Xã Sơn Lang, Huyện KBang, Gia Lai","Biển Hồ Chè Gia Lai, một điểm đặc sắc giữa vùng đất Tây Nguyên, nổi tiếng với sự kết hợp tuyệt vời giữa hồ nước thủy lợi và nương chè bạt ngàn. Khi nhắc đến Gia Lai, người ta không thể không liên tưởng đến những biển hồ rộng lớn, trong đó, Hồ Chè là điểm du lịch được săn đón hàng đầu.

Nằm trên bờ Bắc của Biển Hồ, đây là nơi thú vị với đồi chè mênh mông, chỉ cách thành phố Pleiku khoảng 13km, thuộc huyện Chư Pah. Khám phá Biển Hồ Chè, du khách sẽ được tận hưởng không khí trong lành của nước hồ và ngắm nhìn vẻ đẹp hùng vĩ của đồi chè xanh ngát bát ngát.",https://images.vietnamtourism.gov.vn/vn//images/2021/Thang_6/bien_ho_che__gia_lai_1221370027_resize.jpeg,Mở cửa cả ngày,https://bienhotea.com.vn/,4.5 sao (1720 đánh giá),14.0808857,107.9976737
Núi Ngọc Linh,"Nằm trong dải dãy Trường Sơn với đỉnh cao nhất là đỉnh Ngọc Linh, Huyện Tu Mơ Rông, Kon Tum","Khối núi Ngọc Linh hay Ngọc Linh liên sơn là khối núi cao nhất miền Trung, Việt Nam nằm trên dải Trường Sơn, là một phần của Trường Sơn Nam.",https://dantocmiennui-media.baotintuc.vn/images/5c2d5ba08b0659aae9d48bffd06a7dd263286a0354c00bada3d415af29f6b22fbb93b8e838f5a89b3046786c19241b78905dcdc2c2aaa089e5e1fbada576b53e2db18dd2dbb7db280cf57a34dadd2a30e2f70135d22d21a88dc4a7c7b5fcf1dd/sam-ngoc-linh-cuu-ngheo-huyen-mien-nui-tra-bong_3-1.jpg,Mở cửa cả ngày,N/A,4.5 sao (73 đánh giá),15.0690415,107.9749364
Thác Dray Sáp,"Nằm trên dòng Serepôk, Xã Đắk Sôr, Huyện Krông Nô, Đắk Nông","Thác Đray Sáp hay Thác Dray Sap là thác trên dòng sông Srêpốk ở vùng đất xã Nam Đà, tỉnh Lâm Đồng, Việt Nam. Thác Đray Sáp còn có tên gọi nữa là thác Chồng.",https://images.baodantoc.vn/uploads/2022/Th%C3%A1ng%205/Ng%C3%A0y%206/To%20Oanh/thac%20nuoc/dray-sap-1-768x340.jpg,"Giá vé vào cổng Thác Dray Sáp dao động từ khoảng 40.000 - 60.000 VNĐ/người. Giá này có thể bao gồm các hoạt động vui chơi cơ bản tại khu du lịch, tuy nhiên, giá vé cụ thể và các dịch vụ đi kèm có thể thay đổi tùy theo từng thời điểm và khu quản lý. 
Giá vé tham khảo: 40.000 - 60.000 VNĐ/người.",Số điện thoại: 0904 924 079,4.3 sao (1066 đánh giá),12.5378544,107.8901678
Hồ Tà Đùng,"Hồ Tà Đùng gắn với đập thủy điện Đồng Nai, Xã Đắk Plao, Huyện Đăk Glong, Đắk Nông","Hồ Đồng Nai 3, còn được gọi là hồ Tà Đùng, là một hồ nhân tạo nằm trong Vườn quốc gia Tà Đùng, thuộc huyện Đắk Glong, tỉnh Đắk Nông. Với diện tích mặt nước là 3.632 ha, bao quanh bởi 47 đảo lớn nhỏ và là nơi sinh sống của nhiều loài chim đặc hữu, hồ Đồng Nai 3 được báo chí mệnh danh là ""Vịnh Hạ Long của Tây Nguyên""",https://images.vietnamtourism.gov.vn/vn//images/2021/Thang_4/ho-ta-dung1.png,Mở cửa cả ngày,,4.7 sao (356 đánh giá),11.8142707,107.9381617
Linh Sơn Viên Giác Tự,"82 405, TT. Núi Đôi, Kiến Thụy, Hải Phòng","Kiến Thụy, miền đất địa linh nhân kiệt, một miền quê sản sinh những con người tuấn kiệt. Vùng quê anh hùng có Kim Sơn kháng Nhật, có Dương Kinh nhà Mạc lẫy lừng một thuở với con người cần mẫn, chịu thương chịu khó, hiếu học mà đầy sáng tạo trong lao động sản xuất, từng bước đưa cuộc sống ngày một phát triển, phồn vinh an lạc. Đồng thời, Kiến Thụy còn là một miền đất giàu truyền thống văn hóa tâm linh. Nhiều ngôi chùa được xây dựng khắp các làng xã trong toàn huyện, cùng với nhiều lễ hội văn hóa được tổ chức nơi đây góp phần làm giàu bản sắc dân tộc của quê hương, đất nước.",https://dulichvn.org.vn/nhaptin/uploads/images/2019/thang3/chualinhthuong.jpg,N/A,N/A,4.4 sao (89 đánh giá),20.7528604,106.6581997
Thác Pongour,"Nằm trên sông Đa Nhim, Xã Phú Hội, Huyện Đức Trọng, Lâm Đồng","Thác Pongour là điểm đến gắn liền với một truyền thuyết đầy bí ẩn. Tương truyền, sự hình thành thác Pongour Lâm Đồng có liên quan đến nàng Kanai xinh đẹp. Ngày xưa, nơi đây từng là một vùng đất bazan màu mỡ được cai quản bởi nữ tù trưởng Kanai. 

Nàng nổi tiếng với tài năng thuần phục thú dữ để làm việc, hỗ trợ cho người dân trong làng. Trong đó phải kể tới 4 con tê giác to khủng lồ được nàng thuần hóa. Công lao của chúng nhiều không kể xiết, tiêu biểu như: giúp nàng Kanai và người dân dời non ngăn suối, khai phá nương rẫy, đồng thời đánh bại kẻ thù, bảo vệ buôn làng… 

Tuy nhiên vào một ngày xuân nọ, nàng Kanai đã trút hơi thở cuối cùng, rời khỏi thế gian. Từ đó, 4 con tê giác quyết không rời nàng nửa bước, cũng chẳng ăn uống, cho đến khi chúng chết. 

Rồi một ngày nọ, người dân trong làng kinh ngạc khi thấy một ngọn thác tuyệt đẹp xuất hiện nơi nàng Kanai yên nghỉ. Họ cho rằng mái tóc của nàng đã hóa thành dòng suối trắng xóa, mát lành. Cùng với đó 4 phiến đá xếp từ cao đến thấp màu xanh rêu được xem là sự hóa thân của 4 cặp sừng tê giác. 

Từ truyền thuyết này, người dân coi ngọn thác là biểu tượng của tinh thần đoàn kết, sự gắn bó chặt chẽ của con người với thiên nhiên. ",https://statics.vinpearl.com/thac-pongour-1_1689673738.jpg,"Giờ mở cửa: 07:00 – 17:30 
Giá vé tham khảo: trẻ em: 10.000 VNĐ/vé; người lớn: 20.000 VNĐ/vé",N/A,4.4 sao (1127 đánh giá),11.6874998,108.2654399
Hồ Tuyền Lâm,"Nằm cách trung tâm thành phố Đà Lạt 5km về hướng nam, Phường 3, Thành phố Đà Lạt, Lâm Đồng","Hồ Tuyền Lâm là một hồ nước thuộc thành phố Đà Lạt tỉnh Lâm Đồng. Đây là hồ nước ngọt rộng nhất Ðà Lạt, với diện tích khoảng 320 ha, nằm cách trung tâm thành phố Đà Lạt 7 km và cách thác Ðatanla 2 km. Hồ nằm gần núi Phụng Hoàng, đây được xem là khu phức hợp tập trung nhiều cảnh quan đẹp và dịch vụ du lịch phong phú",https://upload.wikimedia.org/wikipedia/commons/thumb/d/d5/Tuyen_Lam_Lake_01.jpg/330px-Tuyen_Lam_Lake_01.jpg,Hít khí trời ở Hồ mọi lúc,N/A,4.6 sao (2175 đánh giá),11.8907954,108.4250836
Khu Di tích núi Voi,"Thôn An Luận, Tiên Hội - xã An Tiến,Thôn Chi Lai - xã Trường Thành, Xã Trường Thành, Huyện An Lão, Thành phố Hải Phòng","Núi Voi thuộc huyện An Lão, cách trung tâm thành phố 20km. Núi Voi - Xuân Sơn là một quần thể núi đá, núi đất khá cao, xen kẽ lẫn nhau, nhấp nhô, uốn khúc qua địa phận của 3 xã Trường Thành, An Tiến và An Thắng của huyện An Lão, thành phố Hải Phòng.",https://static.vinwonders.com/production/nui-voi-1.jpg,"Lễ hội núi Voi An Lão Hải Phòng
Địa điểm tổ chức: Lễ hội diễn ra tại đền thờ nữ tướng Lê Chân
Thời gian diễn ra: Lễ hội được diễn ra vào rằm tháng giêng hàng năm.
Ý nghĩa của lễ hội: Lễ hội được tổ chức hàng năm để người dân tôn vinh cũng như tưởng nhớ công lao của những vị anh hùng dân tộc đã chiến đấu và bảo vệ vùng đất này.",N/A,4.5 sao (97 đánh giá),20.8345359222395,106.583247410123
Cung đường Tà Năng,"Tà Năng
Đức Trọng
Lâm Đồng",,https://media-cdn-v2.laodong.vn/storage/newsportal/2023/10/8/1251758/Ta-Nang---Phan-Dung--02.jpg,N/A,N/A,4.8 sao (80 đánh giá),15.9791533,108.2138365
Núi Lang Bian,"Nằm ở phía bắc thành phố Đà Lạt 12km, Thị trấn Lạc Dương, Huyện Lạc Dương, Lâm Đồng","Vị trí: Núi Lang Bian nằm trên địa bàn huyện Lạc Dương, cách trung tâm thành phố Đà Lạt 12km về phía bắc.

	Đặc điểm: Đây là địa điểm thích hợp cho các nhà dân tộc học, cho các du khách yêu văn hoá truyền thống đến nghiên cứu văn hoá của các dân tộc Nam Tây Nguyên.",http://csdl.vietnamtourism.gov.vn/uploads/images/icon/Langbian05thienJPG.jpg,N/A,N/A,4.2 sao (186 đánh giá),20.7227406,106.7960089
Cù Lao Câu,"Cách thành phố Phan Thiết khoảng 110km về hướng Đông Bắc, Xã Vĩnh Hảo, Huyện Tuy Phong, Bình Thuận","Cù lao Câu (hay cù lao Cau) là hòn đảo nhỏ nằm ở huyện Tuy Phong, Bình Thuận. Hòn đảo này cách thành phố Phan Thiết khoảng 110km, cách Sài Gòn khoảng 240km. Từ đất liền muốn đi ra đảo cần đi thuyền hoặc tàu lớn, cano. Diện tích hòn đảo này khá nhỏ, chỉ khoảng hơn 10km.

Hiện tại, cù lao Câu vẫn là hòn đảo khá hoang sơ nên vẫn giữ nguyện được vẻ đẹp và đặc biệt là rất ít rác. Hòn đảo được bao bọc bởi nước biển xanh ngắt và màu nước biến đổi theo từng thời điểm khác nhau trong ngày. Ngoài ra, dưới lòng biển còn ẩn chứa cả một hệ sinh thái san hô vô cùng độc đáo.","https://ik.imagekit.io/tvlk/blog/2022/11/go-and-share-du-lich-cu-lao-cau-1.jpg?tr=q-70,c-at_max,w-500,h-250,dpr-2","Giờ mở cửa: Không có giờ cố định, phụ thuộc vào lịch tàu/cano chạy
Giá vé: Không có vé tham quan đảo, chi phí chủ yếu là vé vận chuyển",SĐT: 0818.610.339 / 0375.217.777,4.6 sao (215 đánh giá),21.028511,105.804817
Chùa Cao Linh,"Quốc lộ 10, Xã Bắc Sơn, Huyện An Dương, Thành phố Hải Phòng","Chùa Cao Linh có diện tích 49.000m2 và tọa lạc tại phía tây cửa ngõ của thành phố Hải Phòng. Chùa được xây dựng giữa một vùng đất cao ráo, rộng lớn, thuộc địa bàn Hà Liên, nay là thôn Bắc Hà, xã Bắc Sơn, huyện An Dương, thành phố Hải Phòng.",https://www.homepaylater.vn/static/493887d4b7dbe09e3c334708b7738e04/81e7a/1_chua_cao_linh_co_nien_dai_co_nhat_o_hai_phong_voi_khong_gian_yen_binh_thanh_tinh_660f755ba4.webp,"Giờ mở cửa: Cả ngày (24/7)
Giá vé: Miễn phí",N/A,4.6 sao (70 đánh giá),10.7768131,106.7002535
Bãi biển Kỳ Co,"nằm dưới chân núi Phương Mai, thuộc địa phận xã Nhơn Lý, TP.","Đặc điểm: được ví như Maldives của Việt Nam với biển xanh, cát trắng, nắng vàng",https://csdl.vietnamtourism.gov.vn/uploads/images/CSDLDLVN2019/BinhDinh/Bienkyco/Bienkyco1.jpg,Giờ mở cửa: 07:00 – 17:30,"SĐT: 0935 595 579
Email: sale2kycohd@gmail.com",4.4 sao (3712 đánh giá),13.8501214,109.2923346
Cù lao Chàm,"Cù Lao Chàm thuộc xã đảo Tân Hiệp, thành phố Hội An, tỉnh Quảng Nam, cách Cửa Đại khoảng 15km, cách phố cổ Hội An khoảng 18km về phía đông.","Đặc điểm: Đây là một trong số rất ít đảo của Việt Nam còn giữ được thảm thực vật có độ che phủ tương đối lớn, là nơi cư trú của nhiều loại động vật quý hiếm trên bờ, dưới biển.",http://csdl.vietnamtourism.gov.vn/uploads/images/CSDLDLVN2019/QuangNam/CuLaoCham/ChamIslands9.jpg,"Giờ mở cửa: Phụ thuộc vào lịch tàu/cano, thường khởi hành từ cảng Cửa Đại lúc 8:30 sáng.
Giá vé (Phí bắt buộc tại đảo):
* Vé tham quan: 70.000 VNĐ/người.
* Phí sinh thái: 20.000 VNĐ/người.
(Tổng cộng 100.000 VNĐ/người, chưa bao gồm vé cano/tàu gỗ ra đảo).","SĐT: 0235 3911063
Website: https://culaochammpa.com.vn",4.6 sao (33 đánh giá),21.028511,105.804817
Phá Tam Giang,"Phá Tam Giang giới hạn phía bắc là cửa sông Ô Lâu, phía nam là cửa sông Hương thông với biển qua cửa Thuận An, thuộc địa phận 12 xã của ba huyện Quảng Ðiền, Phong Ðiền và Hương Trà.","Đặc điểm: Phá Tam Giang và Cầu Hai là 2 đầm phá nước lợ lớn nhất, tiêu biểu nhất ở Việt Nam.",http://csdl.vietnamtourism.gov.vn/uploads/images/icon/58phatamgiang01.jpg,"Giờ mở cửa: Không gian công cộng, mở 24/7. Thời gian tham quan đẹp nhất là sáng sớm hoặc chiều tối.
Giá vé: Miễn phí tham quan. Các chi phí phát sinh nếu sử dụng dịch vụ như tour thuyền ngắm hoàng hôn.",N/A,4.6 sao (449 đánh giá),20.7227406,106.7960089
Sông Hương,Dòng sông thơ mộng chảy qua Tp.,"Đặc điểm: Sông Hương đẹp từ nguồn, uốn lượn quanh co giữa núi rừng, đồi cây mang theo những mùi vị hương thơm của thảo mộc rừng nhiệt đới.",https://csdl.vietnamtourism.gov.vn/uploads/images/CSDLDLVN2019/ThuathienHue/SongHuong/Perfume-River-Huong-River.jpg,"Giờ mở cửa: Không gian công cộng. Giờ hoạt động của thuyền rồng du lịch:
* Thứ 2 - Thứ 5: 08:00 – 21:00.
* Thứ 6 - Chủ Nhật: 08:00 – 22:00.
Giá vé: Miễn phí dạo bộ.",N/A,"4,5 sao (408 đánh giá)",10.7768131,106.7002535
Động Thiên Đường,"xã Sơn Trạch, huyện Bố Trạch, tỉnh Quảng Bình, cách trung tâm thành phố Đồng Hới khoảng 70km về phía tây bắc.","Đặc điểm: Thiên Đường là hang động khô dài nhất châu Á với chiều dài 31,4km.",https://csdl.vietnamtourism.gov.vn/uploads/images/CSDLDLVN2019/QuangBinh/DongThienduong/ThienDuongGrotto-8JPG.jpg,"Giờ mở cửa (Tham quan 1km sàn gỗ): Mùa hè (Tháng 4 - 8): 06:00 – 17:00; Mùa đông (Tháng 9 - 3): 07:30 – 16:30.
Giá vé: Người lớn: 250.000 VNĐ/lượt; Trẻ em (1.1m - 1.3m): 125.000 VNĐ/lượt.","SĐT (Phòng Kinh doanh): (0232) 3 818181
Website: www.dongthienduong.com 
Email: Sales@dongthienduong.com",4.7 sao (6865 đánh giá),16.054407,108.202167
Hang Sơn Đoòng,"Xã Sơn Trạch, huyện Bố Trạch, tỉnh Quảng Bình, thuộc vùng lõi Vườn quốc gia Phong Nha - Kẻ Bàng.",Đặc điểm: Là hang động tự nhiên lớn nhất thế giới hiện nay.,http://csdl.vietnamtourism.gov.vn/uploads/images/icon/SonDong.jpg,"Giờ mở cửa: Không mở cửa tham quan tự do. Chỉ có thể khám phá thông qua tour thám hiểm đăng ký trước.
Giá vé: Chi phí Thám hiểm Sơn Đoòng là US$3,000 cho mỗi khách, giá tour này đã bao gồm thuế VAT, phí tham quan và phí dịch vụ môi trường rừng (US$600), phí quản lý và phí giám sát của vườn quốc gia (US$20).","SĐT: +84 232 3677 678
Hotline: +84 919 900 357
Email: contact@oxalisadventure.com",4.7 sao (1108 đánh giá),10.823099,106.629664
Hang Én,"thuộc vùng lõi của Di sản Thiên nhiên Thế giới Vườn quốc gia Phong Nha - Kẻ Bàng, Quảng Bình.","Đặc điểm: hang động được đánh giá là lớn thứ 3 trên thế giới, sau hang Sơn Đoòng (Việt Nam) và hang Deer (Malaysia).",http://csdl.vietnamtourism.gov.vn/uploads/images/CSDLDLVN2019/QuangBinh/HangEn/HangEn.jpg,"Giờ mở cửa: Không mở cửa tham quan tự do. Chỉ có thể khám phá thông qua tour trekking 2 ngày 1 đêm.
Giá vé: Chi phí tour trekking khoảng 7.500.000 - 8.000.000 VNĐ/người.","Hotline: +84 919 900 357
Email: contact@oxalisadventure.com",4.7 sao (107 đánh giá),14.659902,108.309072
Biển Cổ Thạch,"Cách thành phố Phan Thiết 90 km, Xã Bình Thạnh, Huyện Tuy Phong, Bình Thuận","Ở huyện Tuy Phong, Bình Thuận có khu du lịch Cổ Thạch, là một khu du lịch nghỉ mát và tâm linh nổi tiếng. Bãi biển Cổ Thạch nằm trong khu du lịch này. Đường bờ biển trải dài suốt một phần bãi biển thuộc xã Bình Thạnh, huyện Tuy Phong.","https://ik.imagekit.io/tvlk/blog/2022/10/kinh-nghiem-du-lich-co-thach-1.jpg?tr=q-70,c-at_max,w-1000,h-600","Giờ mở cửa: Không gian công cộng, mở 24/7.
Giá vé: Miễn phí tham quan.",N/A,"4,2 sao (2171 đánh giá)",17.971576,106.326887
Đồi cát Nam Cương,"Cách thành phố Phan Rang gần 8km, Xã An Hải, Huyện Ninh Phước, Ninh Thuận","Khu vực hoang mạc có cảnh biển và núi, nổi tiếng với cảnh hoàng hôn cùng những lối đi xe đạp và khu cắm trại.","https://ik.imagekit.io/tvlk/blog/2023/06/juQWBy8s-image.png?tr=q-70,c-at_max,w-1000,h-600","Giờ mở cửa: Không gian công cộng, mở 24/7 (Thời gian tham quan đẹp nhất là 05:00 - 07:00 sáng hoặc 16:00 - 18:00 chiều để tránh nắng gắt).
Giá vé: Miễn phí.",N/A,4.3 sao (1093 đánh giá),12.238981,109.196647
Hang Rái,"Hang Rái nằm ở phía nam vịnh Vĩnh Hy, Xã Vĩnh Hải, Huyện Ninh Hải, Ninh Thuận","Mặc dù nhiều người thường gọi là hang Rái Vĩnh Hy Nha Trang, nhưng thực tế hang Rái thuộc tỉnh Ninh Thuận. 

Cụ thể, hang Rái Vĩnh Hy có địa chỉ tại vịnh Vĩnh Hy, xã Vĩnh Hải. Khu du lịch hang Rái nằm cách Phan Rang 40km, Nha Trang - Khánh Hòa 90km và cách trung tâm Cam Ranh - Khánh Hòa 40km.

Hang Rái Vĩnh Hy Ninh Thuận có một vẻ đẹp nên thơ hiếm có. Không chỉ được bao quanh bởi núi và sông. Nơi đây còn có những rạn san hô tự nhiên cùng hang núi kéo dài tới tận cửa biển phía Nam.

",https://images.vietnamtourism.gov.vn/vn//images/2021/Thang_6/hang-rai-ninh-thuan_01.jpg,"Giờ mở cửa: 07:30 – 17:00.
Giá vé: 20.000 VNĐ/người (Đây là vé tham quan khu vực Hang Rái, thuộc Vườn Quốc gia Núi Chúa).","SĐT (VQG Núi Chúa): 0259 3874 080
Website: vqgnuichua.vn
Email: vqgnuichua@ninhthuan.gov.vn",N/A,11.679682168858,109.178106096072
