TenDiaDanh,DiaChi,NoiDung,ImageURL,DichVu,ThongTinLienHe,DanhGia (Google Map),Lat,Lng
Di tích lịch sử - văn hóa căn cứ địa cách mạng Hải Chi (Đình Làng Dạ),"Xã Thanh Lâm, Huyện Ba Chẽ, Quảng Ninh","Căn cứ địa cách mạng Hải Chi là một địa danh lịch sử quan trọng, từng là căn cứ kháng chiến trong hai cuộc kháng chiến chống thực dân Pháp và đế quốc Mỹ. Nơi đây đóng vai trò quan trọng trong phong trào cách mạng của địa phương và đất nước. ",https://media.quangninh.gov.vn/2aec8815-e57b-4e45-a296-0f2451b3b976/Libraries/hinhanhbaiviet/thong%20tin%20chung%20huyen%20ba%20che/le%20hoi%20dinh%20lang%20da%202017/nghi%20le%20dung%20cay%20neu.jpg?time=1516612970237,N/A,N/A,N/A,21.2870445,107.0684475
Chợ Trung tâm Ba Chẽ,"Thị trấn Ba Chẽ, Huyện Ba Chẽ, Quảng Ninh","Khu chợ nhộn nhịp này mang đến cho du khách cơ hội độc đáo để đắm mình trong vẻ đẹp chân thực của vùng cao nguyên, thưởng thức các món đặc sản địa phương và khám phá các nghề thủ công truyền thống.",https://media.quangninh.gov.vn/d07e4659-2aae-4343-a2d5-478b67c08003/Libraries/HinhAnhBaiViet/02122019bache1.png,N/A,N/A,3.9 sao (40 đánh giá),21.2726874,107.2925978
Di tích lịch sử Miếu Ông – Miếu Bà,"Xã Nam Sơn, Huyện Ba Chẽ, Quảng Ninh","Miếu Ông và Miếu Bà tọa lạc trên núi Cái Tăn, sát bờ trái sông Ba Chẽ. Miếu Bà được xây dựng từ năm 1931 và được tôn tạo vào năm 2014. Khu di tích này không chỉ là điểm đến tín ngưỡng mà còn là nơi giáo dục thế hệ mai sau về đạo lý ""uống nước nhớ nguồn"". Lễ hội Miếu Ông - Miếu Bà cũng được tổ chức hàng năm, thu hút đông đảo người dân và du khách tham gia.",https://media.baoquangninh.vn/dataimages/202011/original/images1449914_IMG_20201109_234357.jpg,N/A,N/A,4.7 sao (19 đánh giá),21.2171532,107.3495765
Phố đi bộ Tiên Yên,"Thị trấn Tiên Yên, Huyện Tiên Yên, Quảng Ninh","Phố đi bộ Tiên Yên được thực hiện ở 2 dãy phố Lý Thường Kiệt và Hoà Bình, thuộc thị trấn Tiên Yên, gồm khu vực văn hoá - dân gian, chợ, ẩm thực. Phố đi bộ được thực hiện với chủ đề “Hồn xưa, nét cũ Tiên Yên phố” nhằm bảo tồn, phát huy giá trị văn hoá truyền thống, xây dựng thị trấn trở thành điểm du lịch.",https://media.baoquangninh.vn/upload/image/202305/medium/2083196_16_pho_di_bo_tien_yen_15503613.jpg,N/A,N/A,4.9 sao (12 đánh giá),21.331128,107.3997841
"Trung tâm Văn hóa, Thể thao các dân tộc vùng Đông Bắc","Xã Yên Than, Huyện Tiên Yên, Quảng Ninh","Trung tâm Văn hóa - Thể thao các dân tộc vùng Đông Bắc được đưa vào sử dụng từ tháng 7/2017. Tại đây, du khách được đáp ứng việc tìm hiểu những nét riêng đời sống văn hóa các tộc người của các huyện, thị, thành phố vùng Đông Bắc.",https://media.baoquangninh.vn/dataimages/201908/original/images1317345_DSC_4828.JPG,N/A,N/A,N/A,21.3334034,107.4041349
Đền thờ Đức ông Hoàng Cần (Miếu Đại Vương),"xã Hải Lạng, Xã Hải Lạng, Huyện Tiên Yên, Quảng Ninh","Theo sách “Đại Nam nhất thống chí” và “Đồng Khánh địa dư chí”, Đức ông Hoàng Cần có công dẹp giặc, giữ yên một vùng biên giới Đông Bắc. Đức ông được triều đình nhà Trần phong tặng chức Khâm Sai Đông Đạo Tiết Chế; triều đình nhà Nguyễn phong tặng chức Khâm Sai Thái Bảo Xuyên Quốc Công Tôn Thân và Bản cảnh thành hoàng. Nhân dân địa phương kính trọng gọi ông là Đại vương, lập đền thờ cúng, còn gọi là Miếu Đại vương.",https://media.baoquangninh.vn/dataimages/201910/original/images1331685_bai_tien_yen_2.jpg,N/A,N/A,N/A,21.3213874,107.3494475
Chợ Tiên Yên,"Thị trấn Tiên Yên, Huyện Tiên Yên, Quảng Ninh","Được đưa vào sử dụng năm 2006, chợ Tiên Yên có tổng diện tích gần 10.000m2 bao gồm 1 nhà chợ chính, 2 dãy chợ phụ. Nhà chợ chính được xây 2 tầng, tầng 1 kinh doanh chủ yếu các mặt hàng khô, điện tử, giầy dép, bánh kẹo và gia dụng. Tầng 2 dành cho các hộ kinh doanh quần áo. Nhà chợ phụ là nơi để các hộ kinh doanh thực phẩm tươi sống, hàng ăn uống v.v..",https://media.baoquangninh.vn//dataimages/202012/original/images1454373_41.jpg,Giờ mở cửa: 7:00 - 18:00,N/A,4.0 sao (987 đánh giá),21.3310971,107.3987406
Thác Pạc Sủi,"Xã Yên Than, Huyện Tiên Yên, Quảng Ninh","Thác gồm 16 tầng thác và gây ấn tượng với du khách với vẻ đẹp hùng vĩ, nguyên sơ và mộc mạc. Dừng chân tại thác Pạc Sủi, du khách không chỉ được thưởng ngoạn cảnh đẹp thiên nhiên núi rừng mà còn được tận hưởng không khí trong lành, rời xa khói bụi của chốn đô thị.",https://statics.vinwonders.com/thac-pac-sui-1_1704788272.jpg,N/A,N/A,,21.377442,107.3830859
Cột mốc 1317(2) và cửa khẩu Hoành Mô,"Xã Hoành Mô, Huyện Bình Liêu, Quảng Ninh","Cột mốc Trung Quốc – Việt Nam 1321 (2) là một trong những biểu tượng biên giới quan trọng nằm ở huyện Bình Liêu, tỉnh Quảng Ninh, Việt Nam, và đánh dấu ranh giới giữa Việt Nam và Trung Quốc. Nó là một điểm đến lịch sử và văn hóa, thu hút sự quan tâm của du khách và những người muốn thấy biên giới quốc gia.",https://cdn.asahiluxstay.com/media/2022/0924/0238-ab83a528848bcf6-mceu-999946749101663987098085.jpg,N/A,N/A,4.6 sao (70 đánh giá),21.5974967,107.4879273
Chợ Đồng Văn,"xẫ Đồng Văn, Xã Đồng Văn, Huyện Bình Liêu, Quảng Ninh","Chợ trung tâm thị trấn Bình Liêu (huyện Bình Liêu, Quảng Ninh) sáng Chủ nhật náo nhiệt người mua kẻ bán. Người Tày, người Dao, người Sán Chỉ… đến chợ không chỉ để trao đổi hàng hóa mà còn gặp gỡ, giao lưu với nhau. Chợ phiên truyền thống ở trung tâm huyện trước đây họp 6 phiên mỗi tháng Âm lịch, nhưng từ những năm 1970 đã chuyển sang ngày Chủ nhật để bà con tiện đi lại, mua bán. Hàng hoá cũng có sự thay đổi, ngoài nông lâm, thổ sản, nông cụ, mật ong, lá thuốc rừng, các loại bánh trái (cóoc mò, bánh ngải, bánh gật gù…) thì nay có thêm nhiều hàng tiêu dùng, thực phẩm từ miền xuôi, các huyện lân cận đưa tới. ",https://bazantravel.com/cdn/medias/uploads/30/30184-cho-dong-van-binh-lieu.jpg,N/A,N/A,4.0 sao (240 đánh giá),23.2768851,105.3609726
Chợ Trung tâm huyện Bình Liêu,"Thị trấn Bình Liêu, Huyện Bình Liêu, Quảng Ninh","Chợ có sức hút đặc biệt, với những gian hàng đầy màu sắc, sản phẩm thủ công tinh xảo và các sản phẩm địa phương hấp dẫn. Khám phá chợ trung tâm Bính Liêu, bạn sẽ trải nghiệm cuộc sống sôi động và mua sắm những món quà độc đáo để ghi nhớ hành trình ấn tượng trong vùng cao nguyên này.",https://media.baoquangninh.vn/dataimages/201802/original/images1025413_1.jpg,"Giờ mở cửa: 06:00 – 18:00 (Thứ 2), 06:00 – 17:00 (Thứ 3 - Thứ 4), 06:30 – 17:00 (Thứ 5 - Thứ 7), 06:00 – 17:30 (Chủ Nhật)",N/A,4.1 sao (100 đánh giá),21.525765,107.39618
Đình Lục Nà,"xẫ Lục Hồn, Huyện Bình Liêu, Quảng Ninh","Đình Lục Nà là nơi thờ thần hoàng làng Hoàng Cần, là một tướng quân, một vị anh hùng dân tộc đã có công lao rất lớn trong cuộc chiến đấu đánh bại giặc phương Bắc đến xâm lăng đất nước ta, bảo vệ non sông bờ cõi; Tại đây còn ghi đậm dấu ấn lịch sử cách mạng huyện Bình Liêu. Ngày 20/11/1945, tại đình Lục Nà đã diễn ra cuộc mít tinh lớn do mặt trận Việt Minh tổ chức, tuyên bố thành lập chính quyền cách mạng lâm thời của huyện. Ngày 18/1/1946, Ủy ban Hành chính huyện Bình Liêu được thành lập; ngày 21/11/1946, Lực lượng Vệ quốc đoàn của huyện cũng được thành lập tại đây.",https://media.vov.vn/sites/default/files/styles/large_watermark/public/2023-08/dinh-luc-na-binh-lieu_qn_1.jpg,N/A,N/A,N/A,21.5495912,107.4268232
Thác Sông Moóc,"Xã Đồng Văn, Huyện Bình Liêu, Quảng Ninh","Thác Sông Moóc là một dòng thác ở bản Sông Moóc, xã Đồng Văn, huyện Bình Liêu, tỉnh Quảng Ninh, nổi tiếng với vẻ đẹp hoang sơ, yên bình và dòng nước trong vắt. Thác có độ cao khoảng 10m, được ví như một bức tranh thiên nhiên dịu dàng giữa núi rừng, mang vẻ đẹp mộc mạc, thu hút du khách yêu thích khám phá những địa điểm ít người biết đến.",https://media.baoquangninh.vn/dataimages/201407/original/images739882_thac_10.JPG,N/A,N/A,N/A,21.5542494,107.5708134
Thác Khe Tiền,"Xã Đồng Văn, Huyện Bình Liêu, Quảng Ninh","Thác Khe Tiền là một quần thể thác ở bản vùng cao Khe Tiền, xã Đồng Văn, huyện Bình Liêu, với hệ thống 3 thác là Khe Tiền 1, 2 và 3. Những dòng thác này được hình thành từ hệ mạch nước dưới chân núi, tạo nên các dòng nước nhỏ đổ thành thác. Thác nước Khe Tiền nằm ngay giữa một khu rừng nguyên sinh thuộc thôn Khe Tiền, bắt nguồn từ ngọn núi Quảng Nam Châu cao 1.500 m so với mức nước biển.",https://images.vietnamtourism.gov.vn/vn//images/2021/thang_12/0712.thac_khe_tien_2_1.jpg,N/A,SĐT: 0948 482 954,4.0 sao (13 đánh giá),21.3982013,107.3902705
Thác Khe Vằn,"Xã Húc Động, Huyện Bình Liêu, Quảng Ninh","Thác Khe Vằn bắt nguồn từ dãy Khe Vằn, nằm ở độ cao hơn 1.000m so với mực nước biển và được coi là thác nước lớn nhất của tỉnh Quảng Ninh. Tên gọi Khe Vằn được giải nghĩa với từ vằn chỉ khói và Khe Vằn có nghĩa là khe nước có khói. Với chiều cao ấn tượng gần 100m, nước chảy từ đỉnh cao cùng những bọt nước tung bay trắng mịn, thác Khe Vằn là điểm đến lý tưởng thu hút mọi du khách khi đến với Quảng Ninh.",https://statics.vinpearl.com/thac-khe-van-1_1703774125.jpg,"
Giờ mở cửa: 08:00–18:00",SĐT: 0969 734 896,4.3 sao (648 đánh giá),21.4858662,107.4783674
Bãi tắm Lương Ngọc,"Khu 1A, Phường Quang Hanh, Thành phố Cẩm Phả, Quảng Ninh","Bãi tắm Lương Ngọc Cẩm Phả mang đến không gian yên bình với bãi cát trắng mịn ôm trọn vịnh Bái Tử Long thơ mộng. Du khách có thể thả mình vào làn nước trong xanh, mát lạnh, tận hưởng gió biển dịu nhẹ hay đơn giản là dạo bước trên bờ cát, ngắm nhìn thiên nhiên tươi đẹp. Ngoài ra, cuối bãi tắm còn có một mỏm núi đá độc đáo với con đường bậc đá rợp bóng cây xanh dẫn lên đỉnh, nơi bạn có thể phóng tầm mắt chiêm ngưỡng toàn cảnh vịnh biển kỳ vĩ.",https://static.vinwonders.com/production/2025/03/tam-bien-o-bai-tam-luong-ngoc.jpg,"Giờ mở cửa: 05:00 - 19:00
Giá vé: 40.000 đồng",SĐT: 0203 3991 999,4.2 sao (427 đánh giá),20.9833107,107.2426792
Bãi tắm Quảng Hồng,"Khu Nam Sơn 2, Phường Cẩm Sơn, Thành phố Cẩm Phả, Quảng Ninh","Bãi tắm Quảng Hồng tọa lạc bên bờ vịnh Bái Tử Long, thuộc phường Cửa Ông, tỉnh Quảng Ninh. Đây là bãi tắm nhân tạo rộng 27,9 ha, do Công ty CP Xây dựng Quảng Hồng đầu tư và quản lý. Với bãi cát trải dài, nước biển xanh mát và không gian được bao bọc bởi dãy núi, bãi tắm Quảng Hồng Quảng Ninh mang vẻ đẹp yên ả, khác biệt so với các bãi tắm sôi động khác. Ngoài ra, nơi đây còn nổi bật với cảnh quan thiên nhiên tươi đẹp, dịch vụ tiện ích đa dạng, thân thiện với môi trường, đáp ứng nhu cầu vui chơi, nghỉ dưỡng của người dân và du khách.",https://static.vinwonders.com/production/2025/03/bai-bien-quang-hong.jpeg,N/A,N/A,N/A,20.9956603,107.3069969
Trung tâm Khoáng nóng Địa chất,"Ngõ 604 Trần Phú, Phường Cẩm Thạch, Thành phố Cẩm Phả, Quảng Ninh","Trung tâm khoáng nóng địa chất được xây dựng từ năm 2000 trên một diện tích đất rộng, cảnh quan khá đẹp, có hồ nước và núi đá, đặc biệt là có mỏ nước khoáng nóng rất có ích cho hoạt động điều dưỡng, chăm sóc sức khỏe. Trước đây, Trung tâm khoáng nóng địa chất chủ yếu là phục vụ cho công nhân ngành Than và người dân địa phương.",https://media-cdn-v2.laodong.vn/storage/newsportal/2025/4/25/1496968/Trung-Tam-Nuoc-Khoan-01.jpg?w=660,Giờ mở cửa: 07:30 - 22:00,SĐT: 1900 633691,4.2 sao (251 đánh giá),21.0154375,107.2590625
Khu di tích lịch sử - Văn hóa Đền Cửa Ông,"Phường Cửa Ông, Thành phố Cẩm Phả, Quảng Ninh","Đền Cửa Ông là 1 trong 3 ngôi đền nổi tiếng nhất của tỉnh Quảng Ninh. Đây là nơi “gặp gỡ” của núi non, rừng già và biển cả, được thiên nhiên ưu ái ban tặng một vị trí đắc địa. Qua sử sách ghi chép lại, Đền Cửa Ông - Quảng Ninh được khởi dựng và tồn tại đã qua hơn 700 năm với nhiều cuộc đại trùng tu. Lúc khởi dựng, ngôi đền chỉ là một thảo am nhỏ, được làm từ tranh, tre, nứa... Vào khoảng năm 1907 - 1916, đền được trùng tu tại. Đến năm 1916, khu di tích xây dựng thêm đền Thượng, đền Trung, đền Hạ và chùa. ",https://static.vinwonders.com/production/den-cua-ong-1.jpg,N/A,N/A,4.6 sao (2191 đánh giá),21.0274468,107.3707765
Khu di tích lịch sử và Danh thắng Vũng Đục,"Khu Diêm Thủy, Phường Cẩm Đông, Thành phố Cẩm Phả, Quảng Ninh","Người dân nơi đây kể lại rằng, sở dĩ khu di tích, danh lam thắng cảnh này có tên gọi là Vũng Đục là bởi trước kia, đây là một khu vực có nhiều vũng sâu, nước xoáy, là nơi quần tụ của hàng ngàn loài sinh vật biển và một điều đặc biệt là ở đây có rất nhiều cá đục. Có lẽ vì thế người dân vạn chài xưa đã đặt tên cho khu vực này là Vũng Đục.",https://media.baoquangninh.vn/dataimages/201507/original/images815324_Tr4_Den_liet_si.jpg,N/A,N/A,N/A,20.9929752,107.2287044
Quảng Ninh Gate,"Xã Bình Dương, Thị xã Đông Triều, Quảng Ninh","Quảng Ninh Gate là khu du lịch vui chơi giải trí có diện tích gần 12 hecta, tọa lạc tại xã Bình Dương, thị xã Đông Triều, tỉnh Quảng Ninh. Nơi đây cách trung tâm thủ đô Hà Nội khoảng 80km, ngoài các trò chơi giải trí và hoạt động nghỉ dưỡng thông thường, du khách sẽ được tham quan cảnh sắc và các hoạt động trải nghiệm thú vị của làng quê miền Bắc. Khu du lịch Quảng Ninh Gate sẽ giúp du khách hòa mình vào cuộc sống sinh hoạt của người dân miền Bắc từ thời xa xưa, đồng thời tìm hiểu về văn hóa và lịch sử của đất nước nói chung và Bắc Bộ nói riêng.",https://mia.vn/media/uploads/blog-du-lich/quang-ninh-gate-12-1697952804.jpg,"Giờ mở cửa: Mở cả ngày
Giá phòng (Resort): dao động 800.000 - 1.300.000 đồng",SĐT: 0888 856 629,"4,1 sao (2111 đánh giá)",21.1161554,106.4674987
Công viên Hà Lan,"Khu Vĩnh Xuân phường Mạo Khê, Phường Mạo Khê, Thị xã Đông Triều, Quảng Ninh","Đây là một điểm đến mới nổi, mang đến hơi thở kiến trúc châu Âu giữa lòng vùng mỏ. Với những chiếc cối xay gió đặc trưng của Hà Lan, thảm cỏ xanh mướt và không gian thoáng đãng, công viên Hà Lan là địa điểm lý tưởng để thư giãn, dạo chơi và chụp ảnh check-in.",https://hvcgroup.net/data/media/2307/files/CVHL2.jpg,Giờ mở cửa: 09:00 - 22:30,SĐT: 0203 3585 299,4.2 sao (827 đánh giá),21.0667709,105.7805964
Hồ Khe Chè,"Thôn Ba Xã, Xã An Sinh, Thị xã Đông Triều, Quảng Ninh","Hồ có tổng diện tích là 276ha, nằm cách đền An Sinh khoảng 3km và cách trung tâm thị xã Đông Triều 7km. Con đường cạnh hồ đã được đổ bê tông bằng phẳng, thuận tiện cho khách du lịch di chuyển bằng nhiều phương tiện khác nhau. Mặt hồ luôn phẳng lặng và trong xanh, tựa như một tấm gương khổng lồ phản chiếu lại cảnh vật. Bao quanh hồ còn có những cánh rừng xanh mướt và nhiều dãy núi trùng điệp, tạo nên một bức tranh sơn thủy cực đẹp mắt. Nơi đây còn đặc trưng với khí hậu ôn hòa, mát mẻ, là điểm đến lý tưởng để du khách thư giãn và khám phá thiên nhiên. ",https://statics.vinpearl.com/ho-khe-che-01_1704968191.jpg,N/A,N/A,N/A,21.1442649,106.5328332
Làng quê Yên Đức,"Thôn Yên Khánh, Xã Yên Đức, Thị xã Đông Triều, Quảng Ninh","Những ngôi nhà mang đậm dấu ấn thời gian, với mái ngói rêu phong, tường gạch thô mộc tạo nên nét đẹp cổ kính, bình dị của làng quê Việt Nam.Người dân nơi đây nổi tiếng với sự hiền hòa, mến khách, luôn sẵn sàng chào đón du khách đến tham quan và trải nghiệm văn hóa địa phương.",https://media.baoquangninh.vn/upload/image/202407/medium/2230246_images1396051_artboard_8anh_2_09441902.jpg,N/A,N/A,N/A,21.05217,106.6282341
Cụm di tích lịch sử cách mạng khu mỏ than Mạo Khê,"Khu Vĩnh Lập, Phường Mạo Khê, Thị xã Đông Triều, Quảng Ninh",Cụm di tích lịch sử khu mỏ than Mạo Khê ghi dấu những hoạt động cách mạng của nhà chí sĩ yêu nước Nguyễn Văn Cừ và cũng là địa điểm thành lập Chi bộ Đảng đầu tiên ở khu mỏ Quảng Ninh.,https://media.baoquangninh.vn/dataimages/201512/original/images842592_a.jpg,N/A,N/A,N/A,21.0589,106.5853
Trung tâm chiến khu Đông Triều - chùa Bắc Mã,"Thôn Bắc Mã, Xã Bình Dương, Thị xã Đông Triều, Quảng Ninh","Di tích lịch sử cách mạng, văn hoá chiến khu Đông Triều là căn cứ lãnh đạo cách mạng trong cuộc kháng chiến chống thực dân pháp. Trung tâm căn cứ này được đặt ở chùa Bắc Mã còn có tên chữ là Phúc Chí Tự nghĩa là chùa hướng tới cái phúc.",https://media.baoquangninh.vn/dataimages/201504/original/images791685_a.jpg,N/A,N/A,N/A,21.1110039543568,106.483073578948
Chùa Hồ Thiên,"Thôn Phú Ninh, Xã Bình Khê, Thị xã Đông Triều, Quảng Ninh","Chùa Hồ Thiên - Đông Triều (hay Trù Phong tự) do Pháp Loa xây dựng năm 1322 trên núi Trù Phong, được sử dụng làm nơi các vị cao tăng của Thiền phái Trúc lâm tu học sau khi đã hoàn thành xuất sắc khóa học tại Tự - viện Quỳnh Lâm.",https://media-cdn-v2.laodong.vn/storage/newsportal/2024/12/6/1431243/Chua-Ho-Thien-2.jpg,N/A,N/A,4.7 sao (85 đánh giá),10.7481967,106.6639181
Chùa Quỳnh Lâm,"Phường Tràng An, Thị xã Đông Triều, Quảng Ninh","Chùa nằm ở trung tâm ba Khu Thượng, Hạ, Sinh. Phía trước cửa chùa là hồ nước lớn, ba phía còn lại là đồi núi bao bọc. Với thế đất này được gọi là thế ngai vàng, hay thế ""Long chầu hổ phục"". Theo các nhà nghiên cứu, qua các tài liệu thư tịch, trong đó có cả bia chùa thì chùa Quỳnh Lâm được xây dựng dưới triều vua Lý Thần Tông (1116-1138). Người có công lớn trong việc tạo dựng ngôi chùa là quốc sư Nguyễn Minh Không (1076-1141). Trong các thế kỷ 11-14, thời kỳ cuối Lê và thế kỷ 17-18, Quỳnh Lâm là trung tâm Phật giáo lớn nhất của Việt Nam.",https://media.baoquangninh.vn/upload/image/202105/medium/1844357__08145429.jpg,N/A,SĐT: 0979 724 666,4.5 sao (287 đánh giá),20.9660384,105.9822535
Đền Thái,"Thôn Trại Lốc, Xã An Sinh, Thị xã Đông Triều, Quảng Ninh","Nằm ở cửa ngõ phía Tây của tỉnh Quảng Ninh, vùng đất Đông Triều là quê gốc của nhà Trần, trước khi chuyển về Tức Mặc (tỉnh Nam Định), Long Hưng (tỉnh Thái Bình) và phát tích đế vương ở đó vào khoảng thế kỷ 12. Từ đời Trần Thái Tông, vua đã cấp An Sinh (Đông Triều) cho anh mình là Trần Liễu làm đất thang mộc để trông coi phần mộ, thờ cúng tổ tiên và phong cho Trần Liễu là An Sinh Vương. Trong hệ thống đền, miếu, lăng mộ, chùa tháp ở đây thì Thái Miếu (còn gọi là Đền Thái), nơi thờ tổ tiên và 14 vị vua Trần là một trong 14 di tích quan trọng bậc nhất trong quần thể Khu di tích.",https://dantocmiennui-media.baotintuc.vn/images/abc4538b3a08bb57a1123e100b4becb2bb72d09ee861fd737fc91f09341b6f9105ba9228a81c087f4ad214f6766b036c7700b42128f0b5d20f20be1597892be0/quangninh5-4003.jpg,Giờ mở cửa: 07:00 - 16:30,N/A,4.5 sao (66 đánh giá),20.4457972,106.3390451
Đền An Sinh,"Thôn Nghĩa Hưng, Xã An Sinh, Thị xã Đông Triều, Quảng Ninh","Đền An Sinh được xây dựng vào thời Trần năm 1381, là nơi thờ ngũ vị Hoàng đế của nhà Trần đã có công làm rạng danh non sông đất nước. Ngũ vị Hoàng đế của nhà Trần bao gồm: Minh Tông Hoàng đế, Anh Tông Hoàng đế, Khâm Minh Thánh Vũ Hiển Đạo An Sinh Hoàng đế, Dụ Tông Hoàng đế và Nghệ Tông Hoàng đế.",https://static.vinwonders.com/production/den-an-sinh-banner.jpg,N/A,N/A,4.4 sao (270 đánh giá),21.118045,106.5374308
Chợ Rừng,"Phường Quảng Yên, Thị xã Quảng Yên, Quảng Ninh",,https://static.vinwonders.com/production/2025/03/cho-rung-banner.jpg,,,,20.9390376,106.7990441
Làng nghề truyền thống Hưng Học,"phường Nam Hòa, Thị xã Quảng Yên, Quảng Ninh","Làng nghề đan ngư cụ truyền thống Hưng Học không chỉ nổi tiếng với nghề đan thuyền nan, mà còn được mọi người biết đến với các sản phẩm ngư cụ phục vụ nhu cầu khai thác, đánh bắt thuỷ hải sản của người dân được làm từ tre, nứa như lờ, nơm, đó, lợp…",https://image.vovworld.vn/w730/uploaded/vovworld/znaeng/2020_08_07/ccl1_xreq.jpg,N/A,N/A,N/A,20.91386,106.79618
Thác Mơ,"Khu Lâm Sinh 2, Phường Minh Thành, Thị xã Quảng Yên, Quảng Ninh","Thác Mơ nằm ở địa phận xã Quảng Yên, tỉnh Quảng Ninh, bắt nguồn từ con suối Mơ dài hơn 2.000m. Nơi đây sở hữu khung cảnh thiên nhiên hùng vĩ, hoang sơ với những khu rừng bạt ngàn xanh mướt và thác nước chảy xiết suốt đêm ngày.",https://static.vinwonders.com/production/niClV0Gy-thac-mo-1.jpg,Giá vé vào cửa: 10.000 VNĐ/người,N/A,N/A,14.0217837,107.6050329
Chùa Yên Mỹ,"Xã Lê Lợi, Thành phố Hạ Long, Quảng Ninh","Chùa Yên Mỹ có tên chữ là Phúc Khánh tự, là di tích kiến trúc nghệ thuật tôn giáo cổ kính, tọa lạc trên một gò đất cao, nhìn ra phía trước là hai ngọn núi chầu vào con sông Đồi Mom, đổ ra vịnh Cửa Lục.",https://tapchivanhoaphatgiao.com/wp-content/uploads/2024/02/LSVDTKTNTTGCYM-1.jpg,N/A,N/A,4.3 sao (16 đánh giá),20.9477327,105.8707411
Đền thờ Tiến sỹ Vũ Phi Hổ,"Xã Lê Lợi, Thành phố Hạ Long, Quảng Ninh","Theo truyền thuyết dân gian và chính sử ghi lại, Đền thờ Phó đô ngự sử Anh nghị Đại vương-Tiến sỹ Vũ Phi Hổ tại xã Lê Lợi, huyện Hoành Bồ được khởi dựng từ thời Lê.",https://cdn.tuoitrethudo.vn/stores/news_dataimages/tuoitrethudocomvn/042017/16/19/den-tho-vi-tien-si-dau-tien-o-quang-ninh-duoc-xep-hang-di-tich-lich-su-18-.4689.png,N/A,N/A,N/A,21.0213486,107.0281062
Đền thờ Vua Lê Thái Tổ,"Xã Lê Lợi, Thành phố Hạ Long, Quảng Ninh","Theo hồ sơ di tích, đền thờ vua Lê Lợi được xây dựng vào cuối thế kỷ XV, toạ lạc trên một gò đất bằng phẳng, xung quanh là sông nước. Xưa kia đền có kiến trúc kiểu chữ ""nhị"" (=) gồm 3 gian bái đường và 3 gian hậu cung, mái lợp ngói vẩy, có sân đền và cổng, xung quanh có tường bao, tạo thành một không gian biệt lập.",https://media.baoquangninh.vn/dataimages/201410/original/images757084_IMG_2236.jpg,N/A,N/A,N/A,21.0169087,107.0421324
